{
  "$schema": "https://json-schema.org/draft/2020-12/schema",
  "$id": "https://fiduciary-wire/schemas/firm.schema.json",
  "title": "firms/<slug>.json",
  "description": "Firm page: SEC facts, every story and every M&A row as acquirer or target.",
  "type": "object",
  "properties": {
    "schema_version": {
      "const": 1
    },
    "slug": {
      "type": "string",
      "pattern": "^[a-z0-9-]+$"
    },
    "name": {
      "type": "string"
    },
    "legal_name": {
      "type": "string"
    },
    "crd": {
      "type": "string"
    },
    "sec_number": {
      "type": [
        "string",
        "null"
      ]
    },
    "city": {
      "type": [
        "string",
        "null"
      ]
    },
    "state": {
      "type": [
        "string",
        "null"
      ]
    },
    "sec_aum_usd": {
      "type": [
        "number",
        "null"
      ]
    },
    "sec_aum_as_of": {
      "type": "string",
      "pattern": "^\\d{4}-\\d{2}-\\d{2}$"
    },
    "iapd_url": {
      "type": "string",
      "pattern": "^https?://"
    },
    "stories": {
      "type": "array",
      "items": {
        "type": "object",
        "properties": {
          "cluster_id": {
            "type": "integer",
            "minimum": 0
          },
          "headline": {
            "type": "string"
          },
          "url": {
            "type": "string",
            "pattern": "^https?://"
          },
          "category": {
            "type": "string",
            "minLength": 1
          },
          "last_published": {
            "type": "string",
            "pattern": "^\\d{4}-\\d{2}-\\d{2}T\\d{2}:\\d{2}:\\d{2}Z$"
          },
          "outlet_count": {
            "type": "integer",
            "minimum": 1
          },
          "sources": {
            "type": "array",
            "items": {
              "type": "object",
              "properties": {
                "name": {
                  "type": "string"
                },
                "url": {
                  "type": "string",
                  "pattern": "^https?://"
                }
              },
              "required": [
                "name",
                "url"
              ],
              "additionalProperties": false
            }
          }
        },
        "required": [
          "cluster_id",
          "headline",
          "url",
          "category",
          "last_published",
          "outlet_count",
          "sources"
        ],
        "additionalProperties": false
      }
    },
    "deals": {
      "type": "array",
      "items": {
        "type": "object",
        "properties": {
          "cluster_id": {
            "type": "integer",
            "minimum": 0
          },
          "date": {
            "type": "string",
            "pattern": "^\\d{4}-\\d{2}-\\d{2}T\\d{2}:\\d{2}:\\d{2}Z$"
          },
          "headline": {
            "type": "string"
          },
          "acquirer": {
            "type": "object",
            "properties": {
              "name": {
                "type": [
                  "string",
                  "null"
                ]
              },
              "slug": {
                "type": [
                  "string",
                  "null"
                ],
                "pattern": "^[a-z0-9-]+$"
              },
              "crd": {
                "type": [
                  "string",
                  "null"
                ]
              }
            },
            "required": [
              "name",
              "slug",
              "crd"
            ],
            "additionalProperties": false
          },
          "target": {
            "type": "object",
            "properties": {
              "name": {
                "type": [
                  "string",
                  "null"
                ]
              },
              "slug": {
                "type": [
                  "string",
                  "null"
                ],
                "pattern": "^[a-z0-9-]+$"
              },
              "crd": {
                "type": [
                  "string",
                  "null"
                ]
              }
            },
            "required": [
              "name",
              "slug",
              "crd"
            ],
            "additionalProperties": false
          },
          "target_aum_usd": {
            "type": [
              "number",
              "null"
            ]
          },
          "target_aum_source": {
            "enum": [
              "headline",
              "sec",
              null
            ]
          },
          "deal_type": {
            "enum": [
              "acquisition",
              "stake",
              "merger",
              "recapitalization",
              null
            ]
          },
          "confidence": {
            "enum": [
              "high",
              "low"
            ]
          },
          "note": {
            "type": "string"
          },
          "press_release": {
            "type": "boolean"
          },
          "sources": {
            "type": "array",
            "items": {
              "type": "object",
              "properties": {
                "name": {
                  "type": "string"
                },
                "url": {
                  "type": "string",
                  "pattern": "^https?://"
                }
              },
              "required": [
                "name",
                "url"
              ],
              "additionalProperties": false
            }
          },
          "role": {
            "enum": [
              "acquirer",
              "target"
            ]
          },
          "stage": {
            "enum": [
              "announced",
              "completed",
              "rumored",
              "bid",
              "terminated"
            ]
          },
          "value_usd": {
            "type": [
              "number",
              "null"
            ]
          },
          "industries": {
            "type": "array",
            "items": {
              "type": "string"
            },
            "minItems": 1
          }
        },
        "required": [
          "cluster_id",
          "date",
          "headline",
          "acquirer",
          "target",
          "target_aum_usd",
          "target_aum_source",
          "deal_type",
          "confidence",
          "note",
          "press_release",
          "sources",
          "role"
        ],
        "additionalProperties": false
      }
    }
  },
  "required": [
    "schema_version",
    "slug",
    "name",
    "legal_name",
    "crd",
    "sec_number",
    "city",
    "state",
    "sec_aum_usd",
    "sec_aum_as_of",
    "iapd_url",
    "stories",
    "deals"
  ],
  "additionalProperties": false
}
