{
 "schema_version": 1,
 "slug": "goldman-sachs-asset-management-107738",
 "name": "Goldman Sachs Asset Management",
 "legal_name": "Goldman Sachs Asset Management",
 "crd": "107738",
 "sec_number": "801-37591",
 "city": "New York",
 "state": "NY",
 "sec_aum_usd": 2648902942827.0,
 "sec_aum_as_of": "2026-09-01",
 "iapd_url": "https://adviserinfo.sec.gov/firm/summary/107738",
 "stories": [
  {
   "cluster_id": 651,
   "headline": "David Solomon eyeing near-term Goldman Sachs CEO exit, reports say, and his heir apparent looks RIA-friendly • DFA search for M&A partner went quiet, and complex factors could prolong the process",
   "url": "https://riabiz.com/a/2026/10/9/david-solomon-eyeing-near-term-goldman-sachs-ceo-exit-reports-say-and-his-heir-apparent-looks-ria-friendly-dfa-search-for-ma-partner-went-quiet-and-complex-factors-could-prolong-the-process",
   "category": "Other",
   "last_published": "2026-10-09T01:57:51Z",
   "outlet_count": 1,
   "sources": [
    {
     "name": "RIABiz",
     "url": "https://riabiz.com/a/2026/10/9/david-solomon-eyeing-near-term-goldman-sachs-ceo-exit-reports-say-and-his-heir-apparent-looks-ria-friendly-dfa-search-for-ma-partner-went-quiet-and-complex-factors-could-prolong-the-process"
    }
   ]
  },
  {
   "cluster_id": 454,
   "headline": "Wealth advisors should adapt services as financial strain hits high earners: Goldman",
   "url": "https://www.financial-planning.com/news/even-some-high-earners-face-financial-strain-in-saving-for-retirement-goldman",
   "category": "Other",
   "last_published": "2026-10-02T09:30:00Z",
   "outlet_count": 1,
   "sources": [
    {
     "name": "Financial Planning",
     "url": "https://www.financial-planning.com/news/even-some-high-earners-face-financial-strain-in-saving-for-retirement-goldman"
    }
   ]
  },
  {
   "cluster_id": 353,
   "headline": "Household costs putting more pressure on retirement savings: Goldman Sachs",
   "url": "https://www.investmentnews.com/retirement-planning/christopher-ceder-senior-retirement-strategist-at-goldman-sachs-asset-management/268406",
   "category": "Other",
   "last_published": "2026-09-30T11:25:54Z",
   "outlet_count": 1,
   "sources": [
    {
     "name": "InvestmentNews",
     "url": "https://www.investmentnews.com/retirement-planning/christopher-ceder-senior-retirement-strategist-at-goldman-sachs-asset-management/268406"
    }
   ]
  },
  {
   "cluster_id": 301,
   "headline": "Goldman Sachs succession plan: John Waldron set to take the top job",
   "url": "https://www.investmentnews.com/wirehouses/goldman-sachs-succession-plan-john-waldron-set-to-take-the-top-job/268388",
   "category": "Other",
   "last_published": "2026-09-29T10:41:00Z",
   "outlet_count": 1,
   "sources": [
    {
     "name": "InvestmentNews",
     "url": "https://www.investmentnews.com/wirehouses/goldman-sachs-succession-plan-john-waldron-set-to-take-the-top-job/268388"
    }
   ]
  }
 ],
 "deals": []
}
