{
 "schema_version": 1,
 "slug": "apella-wealth-171106",
 "name": "Apella Wealth",
 "legal_name": "Apella Capital",
 "crd": "171106",
 "sec_number": "801-79650",
 "city": "West Hartford",
 "state": "CT",
 "sec_aum_usd": 11065217421.0,
 "sec_aum_as_of": "2026-10-02",
 "iapd_url": "https://adviserinfo.sec.gov/firm/summary/171106",
 "stories": [
  {
   "cluster_id": 740,
   "headline": "Waverly, Apella buy $412M in RIA assets across Oregon, Northeast",
   "url": "https://www.investmentnews.com/ria-news/waverly-apella-buy-412m-in-ria-assets-across-oregon-northeast/268581",
   "category": "Wealth Management & RIAs",
   "last_published": "2026-10-13T20:46:29Z",
   "outlet_count": 1,
   "sources": [
    {
     "name": "InvestmentNews",
     "url": "https://www.investmentnews.com/ria-news/waverly-apella-buy-412m-in-ria-assets-across-oregon-northeast/268581"
    }
   ]
  }
 ],
 "deals": []
}
