{
 "schema_version": 1,
 "slug": "hightower-advisors-145323",
 "name": "Hightower Advisors",
 "legal_name": "Hightower Advisors",
 "crd": "145323",
 "sec_number": "801-69625",
 "city": "Chicago",
 "state": "IL",
 "sec_aum_usd": 198577009283.0,
 "sec_aum_as_of": "2026-09-01",
 "iapd_url": "https://adviserinfo.sec.gov/firm/summary/145323",
 "stories": [
  {
   "cluster_id": 352,
   "headline": "RIA moves: Hightower Signature Wealth adds New England reach with $752M Sandy Cove Advisors",
   "url": "https://www.investmentnews.com/ria-news/ria-moves-hightower-signature-wealth-adds-new-england-reach-with-752m-sandy-cove-advisors/268414",
   "category": "Wealth Management & RIAs",
   "last_published": "2026-09-30T20:35:31Z",
   "outlet_count": 2,
   "sources": [
    {
     "name": "InvestmentNews",
     "url": "https://www.investmentnews.com/ria-news/ria-moves-hightower-signature-wealth-adds-new-england-reach-with-752m-sandy-cove-advisors/268414"
    },
    {
     "name": "Financial Advisor Magazine",
     "url": "https://news.google.com/rss/articles/CBMioAFBVV95cUxOVnVQU2sxU2hLckJJUjMwZXBaaS1aalJjVDhGTzVMcDc4T3MyWHprZDV4dERFeHBhakxMcUk0WFdEYUg4dXQ0Vms0QTNVRGk2dERIdXk0cVVPek9iMXkzeXROQXdsMWt4VnM5Z1dNVGpTSE5pWk5YeFl4NTFYUWR6TGFoX3R6SFctN3dzRlIyaGpnbXhOSk5XdldCNzJfNlBw?oc=5"
    }
   ]
  }
 ],
 "deals": []
}
