{
 "schema_version": 1,
 "slug": "pacific-sage-partners-315663",
 "name": "Pacific Sage Partners",
 "legal_name": "Pacific Sage Partners",
 "crd": "315663",
 "sec_number": "801-122834",
 "city": "Edmonds",
 "state": "WA",
 "sec_aum_usd": 986251535.0,
 "sec_aum_as_of": "2026-10-02",
 "iapd_url": "https://adviserinfo.sec.gov/firm/summary/315663",
 "stories": [
  {
   "cluster_id": 1114,
   "headline": "Captrust Acquires $1.1B Pacific Northwest RIA",
   "url": "https://www.wealthmanagement.com/ria-news/captrust-acquires-pacific-sage-partners-in-washington",
   "category": "Wealth Management & RIAs",
   "last_published": "2026-10-29T10:01:39Z",
   "outlet_count": 2,
   "sources": [
    {
     "name": "WealthManagement.com",
     "url": "https://www.wealthmanagement.com/ria-news/captrust-acquires-pacific-sage-partners-in-washington"
    },
    {
     "name": "InvestmentNews",
     "url": "https://www.investmentnews.com/mergers-acquisitions/ria-moves-captrust-adds-11b-pacific-northwest-ria-to-growing-wealth-platform/268794"
    }
   ]
  }
 ],
 "deals": []
}
