{
 "schema_version": 1,
 "slug": "shufro-rose-3403",
 "name": "Shufro, Rose",
 "legal_name": "Shufro, Rose",
 "crd": "3403",
 "sec_number": "801-977",
 "city": "New York",
 "state": "NY",
 "sec_aum_usd": 2463652453.0,
 "sec_aum_as_of": "2026-09-01",
 "iapd_url": "https://adviserinfo.sec.gov/firm/summary/3403",
 "stories": [
  {
   "cluster_id": 109,
   "headline": "Cerity Partners to merge with $1.4B Shufro Rose advisory teams",
   "url": "https://www.investmentnews.com/ria-news/cerity-partners-merges-with-14b-shufro-rose-advisory-teams/268310",
   "category": "Wealth Management & RIAs",
   "last_published": "2026-09-23T10:36:00Z",
   "outlet_count": 1,
   "sources": [
    {
     "name": "InvestmentNews",
     "url": "https://www.investmentnews.com/ria-news/cerity-partners-merges-with-14b-shufro-rose-advisory-teams/268310"
    }
   ]
  }
 ],
 "deals": []
}
