{
 "schema_version": 1,
 "slug": "sandy-cove-advisors-152482",
 "name": "Sandy Cove Advisors",
 "legal_name": "Sandy Cove Advisors",
 "crd": "152482",
 "sec_number": "801-107724",
 "city": "Hingham",
 "state": "MA",
 "sec_aum_usd": 684905062.0,
 "sec_aum_as_of": "2026-09-01",
 "iapd_url": "https://adviserinfo.sec.gov/firm/summary/152482",
 "stories": [
  {
   "cluster_id": 352,
   "headline": "RIA moves: Hightower Signature Wealth adds New England reach with $752M Sandy Cove Advisors",
   "url": "https://www.investmentnews.com/ria-news/ria-moves-hightower-signature-wealth-adds-new-england-reach-with-752m-sandy-cove-advisors/268414",
   "category": "Wealth Management & RIAs",
   "last_published": "2026-09-30T20:35:31Z",
   "outlet_count": 2,
   "sources": [
    {
     "name": "InvestmentNews",
     "url": "https://www.investmentnews.com/ria-news/ria-moves-hightower-signature-wealth-adds-new-england-reach-with-752m-sandy-cove-advisors/268414"
    },
    {
     "name": "Financial Advisor Magazine",
     "url": "https://news.google.com/rss/articles/CBMioAFBVV95cUxOVnVQU2sxU2hLckJJUjMwZXBaaS1aalJjVDhGTzVMcDc4T3MyWHprZDV4dERFeHBhakxMcUk0WFdEYUg4dXQ0Vms0QTNVRGk2dERIdXk0cVVPek9iMXkzeXROQXdsMWt4VnM5Z1dNVGpTSE5pWk5YeFl4NTFYUWR6TGFoX3R6SFctN3dzRlIyaGpnbXhOSk5XdldCNzJfNlBw?oc=5"
    }
   ]
  }
 ],
 "deals": [
  {
   "cluster_id": 352,
   "date": "2026-09-30T13:30:23Z",
   "headline": "RIA moves: Hightower Signature Wealth adds New England reach with $752M Sandy Cove Advisors",
   "acquirer": {
    "name": "Hightower Signature Wealth",
    "slug": null,
    "crd": null
   },
   "target": {
    "name": "Sandy Cove Advisors",
    "slug": "sandy-cove-advisors-152482",
    "crd": "152482"
   },
   "target_aum_usd": 752000000.0,
   "target_aum_source": "headline",
   "deal_type": "acquisition",
   "confidence": "high",
   "note": "",
   "stage": "announced",
   "value_usd": null,
   "industries": [
    "Wealth Management & RIAs"
   ],
   "press_release": false,
   "sources": [
    {
     "name": "InvestmentNews",
     "url": "https://www.investmentnews.com/ria-news/ria-moves-hightower-signature-wealth-adds-new-england-reach-with-752m-sandy-cove-advisors/268414"
    },
    {
     "name": "Financial Advisor Magazine",
     "url": "https://news.google.com/rss/articles/CBMioAFBVV95cUxOVnVQU2sxU2hLckJJUjMwZXBaaS1aalJjVDhGTzVMcDc4T3MyWHprZDV4dERFeHBhakxMcUk0WFdEYUg4dXQ0Vms0QTNVRGk2dERIdXk0cVVPek9iMXkzeXROQXdsMWt4VnM5Z1dNVGpTSE5pWk5YeFl4NTFYUWR6TGFoX3R6SFctN3dzRlIyaGpnbXhOSk5XdldCNzJfNlBw?oc=5"
    }
   ],
   "role": "target"
  }
 ]
}
