{
 "schema_version": 1,
 "slug": "gilead-capital-282023",
 "name": "Gilead Capital",
 "legal_name": "Gilead Capital",
 "crd": "282023",
 "sec_number": "801-107184",
 "city": "New York",
 "state": "NY",
 "sec_aum_usd": 39070470.0,
 "sec_aum_as_of": "2026-10-02",
 "iapd_url": "https://adviserinfo.sec.gov/firm/summary/282023",
 "stories": [
  {
   "cluster_id": 1033,
   "headline": "Gilead to pay $1.3B upfront for PepStar’s oral IL-23 challenger to J&J’s Icotyde",
   "url": "https://www.fiercebiotech.com/biotech/gilead-pay-13b-upfront-pepstars-oral-il-23-challenger-jjs-icotyde",
   "category": "Healthcare & Life Sciences",
   "last_published": "2026-10-23T07:00:00Z",
   "outlet_count": 1,
   "sources": [
    {
     "name": "Fierce Biotech",
     "url": "https://www.fiercebiotech.com/biotech/gilead-pay-13b-upfront-pepstars-oral-il-23-challenger-jjs-icotyde"
    }
   ]
  }
 ],
 "deals": [
  {
   "cluster_id": 1033,
   "date": "2026-10-23T07:00:00Z",
   "headline": "Gilead to pay $1.3B upfront for PepStar’s oral IL-23 challenger to J&J’s Icotyde",
   "acquirer": {
    "name": "Gilead",
    "slug": "gilead-capital-282023",
    "crd": "282023"
   },
   "target": {
    "name": "IL-23",
    "slug": null,
    "crd": null
   },
   "target_aum_usd": null,
   "target_aum_source": null,
   "deal_type": "acquisition",
   "confidence": "high",
   "note": "",
   "stage": "announced",
   "value_usd": 1300000000.0,
   "industries": [
    "Healthcare & Life Sciences"
   ],
   "press_release": false,
   "sources": [
    {
     "name": "Fierce Biotech",
     "url": "https://www.fiercebiotech.com/biotech/gilead-pay-13b-upfront-pepstars-oral-il-23-challenger-jjs-icotyde"
    }
   ],
   "role": "acquirer"
  }
 ]
}
