{
 "schema_version": 1,
 "slug": "oaktree-capital-management-106793",
 "name": "Oaktree Capital Management",
 "legal_name": "Oaktree Capital Management",
 "crd": "106793",
 "sec_number": "801-48923",
 "city": "Los Angeles",
 "state": "CA",
 "sec_aum_usd": 183286850212.0,
 "sec_aum_as_of": "2026-10-02",
 "iapd_url": "https://adviserinfo.sec.gov/firm/summary/106793",
 "stories": [
  {
   "cluster_id": 963,
   "headline": "Oaktree’s Deal to Buy A-Cap Insurer Crumbles, Spawning New Talks",
   "url": "https://www.insurancejournal.com/news/southeast/2026/10/20/889671.htm",
   "category": "Insurance",
   "last_published": "2026-10-20T14:27:21Z",
   "outlet_count": 1,
   "sources": [
    {
     "name": "Insurance Journal",
     "url": "https://www.insurancejournal.com/news/southeast/2026/10/20/889671.htm"
    }
   ]
  }
 ],
 "deals": []
}
